{
  "schema": "wang-tileset-snapshot-v1",
  "geometry": "square",
  "directions": [
    "N",
    "E",
    "S",
    "W"
  ],
  "colors": [
    0,
    1,
    2,
    3,
    4,
    5,
    6,
    7,
    8,
    9,
    10,
    11,
    12,
    13,
    14,
    15
  ],
  "tiles": [
    {
      "tile_id": 0,
      "edges": {
        "N": 0,
        "E": 2,
        "S": 7,
        "W": 1
      }
    },
    {
      "tile_id": 1,
      "edges": {
        "N": 7,
        "E": 2,
        "S": 8,
        "W": 1
      }
    },
    {
      "tile_id": 2,
      "edges": {
        "N": 8,
        "E": 2,
        "S": 0,
        "W": 1
      }
    },
    {
      "tile_id": 3,
      "edges": {
        "N": 0,
        "E": 3,
        "S": 0,
        "W": 1
      }
    },
    {
      "tile_id": 4,
      "edges": {
        "N": 0,
        "E": 4,
        "S": 0,
        "W": 2
      }
    },
    {
      "tile_id": 5,
      "edges": {
        "N": 0,
        "E": 4,
        "S": 9,
        "W": 3
      }
    },
    {
      "tile_id": 6,
      "edges": {
        "N": 9,
        "E": 3,
        "S": 0,
        "W": 2
      }
    },
    {
      "tile_id": 7,
      "edges": {
        "N": 0,
        "E": 2,
        "S": 0,
        "W": 2
      }
    },
    {
      "tile_id": 8,
      "edges": {
        "N": 0,
        "E": 3,
        "S": 0,
        "W": 3
      }
    },
    {
      "tile_id": 9,
      "edges": {
        "N": 5,
        "E": 2,
        "S": 5,
        "W": 2
      }
    },
    {
      "tile_id": 10,
      "edges": {
        "N": 5,
        "E": 3,
        "S": 5,
        "W": 3
      }
    },
    {
      "tile_id": 11,
      "edges": {
        "N": 0,
        "E": 10,
        "S": 6,
        "W": 2
      }
    },
    {
      "tile_id": 12,
      "edges": {
        "N": 6,
        "E": 2,
        "S": 0,
        "W": 10
      }
    },
    {
      "tile_id": 13,
      "edges": {
        "N": 0,
        "E": 11,
        "S": 6,
        "W": 3
      }
    },
    {
      "tile_id": 14,
      "edges": {
        "N": 6,
        "E": 3,
        "S": 0,
        "W": 11
      }
    },
    {
      "tile_id": 15,
      "edges": {
        "N": 6,
        "E": 2,
        "S": 12,
        "W": 2
      }
    },
    {
      "tile_id": 16,
      "edges": {
        "N": 12,
        "E": 2,
        "S": 5,
        "W": 2
      }
    },
    {
      "tile_id": 17,
      "edges": {
        "N": 6,
        "E": 2,
        "S": 13,
        "W": 3
      }
    },
    {
      "tile_id": 18,
      "edges": {
        "N": 13,
        "E": 3,
        "S": 5,
        "W": 2
      }
    },
    {
      "tile_id": 19,
      "edges": {
        "N": 6,
        "E": 3,
        "S": 14,
        "W": 2
      }
    },
    {
      "tile_id": 20,
      "edges": {
        "N": 14,
        "E": 2,
        "S": 5,
        "W": 3
      }
    },
    {
      "tile_id": 21,
      "edges": {
        "N": 6,
        "E": 3,
        "S": 15,
        "W": 3
      }
    },
    {
      "tile_id": 22,
      "edges": {
        "N": 15,
        "E": 3,
        "S": 5,
        "W": 3
      }
    }
  ]
}
